{
  "$schema": "https://json-schema.org/draft/2020-12/schema",
  "$id": "https://canitoolcall.dev/spec/0.1/family.schema.json",
  "title": "CanIToolCall model family",
  "description": "fixtures/<slug>/family.json: metadata shared by every fixture of one tool-call format family.",
  "type": "object",
  "additionalProperties": false,
  "required": ["slug", "name", "spec_version", "has_reasoning", "markers", "reference_models", "format_notes"],
  "properties": {
    "slug": { "type": "string", "pattern": "^[a-z0-9][a-z0-9.-]*$" },
    "name": { "type": "string" },
    "spec_version": { "const": "0.1" },
    "has_reasoning": { "type": "boolean" },
    "markers": {
      "description": "Format markers (special tokens and structural tags) that must never leak into parsed content, reasoning_content or arguments unless the expected result contains them verbatim.",
      "type": "array",
      "minItems": 1,
      "uniqueItems": true,
      "items": { "type": "string", "minLength": 1 }
    },
    "reference_models": {
      "description": "Models whose tokenizer/template adapters use for this family, keyed by variant label (e.g. \"qwen3-hybrid\", \"qwen3-thinking-2507\").",
      "type": "array",
      "minItems": 1,
      "items": {
        "type": "object",
        "additionalProperties": false,
        "required": ["repo", "revision"],
        "properties": {
          "repo": { "type": "string" },
          "revision": { "type": "string" },
          "variant": { "type": "string" },
          "default_generation_prompt": { "type": "string" },
          "stop_tokens": {
            "description": "Stop token strings from generation_config.json / the engine; the text in raw_output ends before these.",
            "type": "array",
            "items": { "type": "string" }
          },
          "gated": { "type": "boolean", "description": "true when the HF repo requires accepting a license; adapters must then use a documented mirror of the template/tokenizer." },
          "tokenizer_mode": { "enum": ["hf", "mistral"], "default": "hf" }
        }
      }
    },
    "format_notes": {
      "description": "Repo-relative path of the human-readable format notes (docs/formats/<slug>.md).",
      "type": "string"
    },
    "notes": { "type": "string" }
  }
}
