{
  "slug": "deepseek",
  "name": "DeepSeek (V3/R1, V3.1, V3.2 DSML, V4 DSML, V4.1 DSML)",
  "spec_version": "0.1",
  "has_reasoning": true,
  "markers": [
    "<｜tool▁calls▁begin｜>",
    "<｜tool▁calls▁end｜>",
    "<｜tool▁call▁begin｜>",
    "<｜tool▁call▁end｜>",
    "<｜tool▁sep｜>",
    "｜DSML｜",
    "<think>",
    "</think>",
    "<｜end▁of▁sentence｜>",
    "<｜Assistant｜>",
    "<｜User｜>"
  ],
  "reference_models": [
    {
      "repo": "deepseek-ai/DeepSeek-V3-0324",
      "revision": "e9b33add76883f293d6bf61f6bd89b497e80e335",
      "variant": "deepseek-v3",
      "default_generation_prompt": "<｜Assistant｜>",
      "stop_tokens": [
        "<｜end▁of▁sentence｜>"
      ]
    },
    {
      "repo": "deepseek-ai/DeepSeek-V3.1",
      "revision": "c0781d039fb7a1ba2abc4add0bdc293e92d2b8db",
      "variant": "deepseek-v31",
      "default_generation_prompt": "<｜Assistant｜></think>",
      "stop_tokens": [
        "<｜end▁of▁sentence｜>"
      ]
    },
    {
      "repo": "deepseek-ai/DeepSeek-V3.2",
      "revision": "a7e62ac04ecb2c0a54d736dc46601c5606cf10a6",
      "variant": "deepseek-v32",
      "default_generation_prompt": "<｜Assistant｜></think>",
      "stop_tokens": [
        "<｜end▁of▁sentence｜>"
      ]
    },
    {
      "repo": "deepseek-ai/DeepSeek-V4-Flash",
      "revision": "60d8d70770c6776ff598c94bb586a859a38244f1",
      "variant": "deepseek-v4",
      "default_generation_prompt": "<｜Assistant｜></think>",
      "stop_tokens": [
        "<｜end▁of▁sentence｜>"
      ]
    },
    {
      "repo": "deepseek-ai/DeepSeek-V4.1-Flash",
      "revision": "dba1be0a40aa45a94ad051997016db3960a90277",
      "variant": "deepseek-v41",
      "default_generation_prompt": "<｜Assistant｜></think>",
      "stop_tokens": [
        "<｜end▁of▁sentence｜>"
      ]
    }
  ],
  "format_notes": "docs/formats/deepseek.md",
  "notes": "Five incompatible sub-formats; models[0] of each fixture selects the sub-format (its variant tag is x-deepseek-v3/-v31/-v32/-v4/-v41). V3.2+ have no Jinja template: DeepSeek's encoding/*.py is the official renderer, and its parse_message_from_completion_text confirms every well-formed expected value. default_generation_prompt is the non-thinking prompt; thinking fixtures record '<｜Assistant｜><think>'. Generated by scripts/fixtures/deepseek/build.py."
}
