{
  "slug": "gemma4",
  "name": "Gemma 4 (<|tool_call>call:NAME{...} object notation)",
  "spec_version": "0.1",
  "has_reasoning": true,
  "markers": [
    "<|tool_call>",
    "<tool_call|>",
    "<|tool_response>",
    "<tool_response|>",
    "<|\"|>",
    "<|channel>",
    "<channel|>",
    "<|turn>",
    "<turn|>",
    "<|think|>"
  ],
  "reference_models": [
    {
      "repo": "google/gemma-4-31B-it",
      "revision": "842da3794eaa0b77d5f08bae87a17459d91ff475",
      "variant": "gemma4",
      "default_generation_prompt": "<|turn>model\n<|channel>thought\n<channel|>",
      "stop_tokens": [
        "<eos>",
        "<|tool_response>",
        "<turn|>"
      ]
    }
  ],
  "format_notes": "docs/formats/gemma4.md",
  "notes": "default_generation_prompt is the thinking-off prompt (the template default). With enable_thinking=true the prompt is '<|turn>model\\n' and the model opens the thought channel itself; each fixture records its own generation_prompt and thinking flag. Generated by scripts/fixtures/gemma4/build.py."
}
