{
  "slug": "qwen3-hermes",
  "name": "Qwen3 (Hermes-style JSON)",
  "spec_version": "0.1",
  "has_reasoning": true,
  "markers": [
    "<tool_call>",
    "</tool_call>",
    "<think>",
    "</think>",
    "<|im_start|>",
    "<|im_end|>"
  ],
  "reference_models": [
    {
      "repo": "Qwen/Qwen3-0.6B",
      "revision": "c1899de289a04d12100db370d81485cdf75e47ca",
      "variant": "qwen3-hybrid",
      "default_generation_prompt": "<|im_start|>assistant\n",
      "stop_tokens": [
        "<|im_end|>"
      ]
    }
  ],
  "format_notes": "docs/formats/qwen3-hermes.md"
}
