{
  "slug": "qwen3-hermes",
  "name": "Qwen3 (Hermes-style JSON tool calls)",
  "spec_version": "0.1",
  "has_reasoning": true,
  "markers": [
    "<tool_call>",
    "</tool_call>",
    "<think>",
    "</think>",
    "<|im_start|>",
    "<|im_end|>",
    "<|endoftext|>"
  ],
  "reference_models": [
    {
      "repo": "Qwen/Qwen3-0.6B",
      "revision": "c1899de289a04d12100db370d81485cdf75e47ca",
      "variant": "qwen3-hybrid",
      "default_generation_prompt": "<|im_start|>assistant\n",
      "stop_tokens": [
        "<|endoftext|>",
        "<|im_end|>"
      ]
    },
    {
      "repo": "Qwen/Qwen3-4B-Thinking-2507",
      "revision": "768f209d9ea81521153ed38c47d515654e938aea",
      "variant": "qwen3-thinking-2507",
      "default_generation_prompt": "<|im_start|>assistant\n<think>\n",
      "stop_tokens": [
        "<|endoftext|>",
        "<|im_end|>"
      ]
    },
    {
      "repo": "Qwen/Qwen3-4B-Instruct-2507",
      "revision": "cdbee75f17c01a7cc42f958dc650907174af0554",
      "variant": "qwen3-instruct-2507",
      "default_generation_prompt": "<|im_start|>assistant\n",
      "stop_tokens": [
        "<|endoftext|>",
        "<|im_end|>"
      ]
    }
  ],
  "format_notes": "docs/formats/qwen3-hermes.md",
  "notes": "Expected content/reasoning are the message fields the template was given; separator newlines the template adds around <think> and before <tool_call> are not part of them (soft-v1 covers engines that keep them). Generated by scripts/fixtures/qwen3-hermes/build.py."
}
